{
  "$schema": "./schema.json",
  "ihaleKayitNo": "2026/194821",
  "kararNo": "2026/842",
  "kurumAdi": "Antalya Büyükşehir Belediye Başkanlığı",
  "isinAdi": "Kültür Merkezi Bahçe Duvarları Yapımı ve Aydınlatma Elemanları Alımı",
  "dosyaKonusu": "Kültür Merkezi Bahçe Duvarları Yapımı ve Aydınlatma Elemanları Alımı",
  "ihaleTarihiVeSaati": "18/06/2026 14:00",
  "ihaleUsulu": "Doğrudan Temin 22/d",
  "dokumanAlanSayisi": "3",
  "toplamTeklifSayisi": "2",
  "gecerliTeklifSayisi": "2",
  "enAvantajliTeklifSahibi": "Kaya Peyzaj ve Mimarlık San. Tic. Ltd. Şti.",
  "enAvantajliTeklifBedeli": "540.200,00",
  "ikinciAvantajliTeklifSahibi": "Arslan İnşaat Taahhüt Tic. A.Ş.",
  "ikinciAvantajliTeklifBedeli": "589.600,00",
  "tutanakTarihi": "18/06/2026",
  "dosyaTarihi": "18/06/2026",
  "tutanakSaati": "14:30",
  "teklifler": [
    {
      "siraNo": "1",
      "istekliUnvani": "Kaya Peyzaj ve Mimarlık San. Tic. Ltd. Şti.",
      "teklifBedeli": "540.200,00",
      "yaziIle": "BEŞYÜZKIRKBİN İKİYÜZ TL"
    },
    {
      "siraNo": "2",
      "istekliUnvani": "Arslan İnşaat Taahhüt Tic. A.Ş.",
      "teklifBedeli": "589.600,00",
      "yaziIle": "BEŞYÜZSEKSENDOKUZBİN ALTIYÜZ TL"
    }
  ],
  "gerekceler": "Komisyonumuzca yapılan değerlendirmede, idari ve teknik şartnameye uygun teklif veren isteklilerden ekonomik açıdan en avantajlı birinci teklif sahibi Kaya Peyzaj ve Mimarlık San. Tic. Ltd. Şti. firması üzerinde bırakılmasına, en avantajlı ikinci teklif sahibinin ise Arslan İnşaat Taahhüt Tic. A.Ş. olmasına oy birliği ile karar verilmiştir.",
  "ihaleKomisyonu": [
    {
      "gorevi": "Komisyon Başkanı",
      "adSoyad": "Ömer ŞAHİN",
      "unvan": "Destek Hizmetleri Daire Başkanı"
    },
    {
      "gorevi": "Komisyon Üyesi",
      "adSoyad": "Selin ÖZTÜRK",
      "unvan": "Mimar"
    },
    {
      "gorevi": "Komisyon Üyesi",
      "adSoyad": "Can DEMİR",
      "unvan": "İnşaat Mühendisi"
    },
    {
      "gorevi": "Komisyon Üyesi",
      "adSoyad": "Gökhan ŞAHİN",
      "unvan": "İdari Personel"
    }
  ]
}
